{
  "key": "f5188fad1c18123e04c40345cb46f99fd1e196ab3a52df90ec02c1666206e107:py-ast-v1",
  "url": "file://C:\\Users\\prest\\Desktop\\Desktop_Projects\\May-Dec-2025\\Tongyi-Agent\\src\\tongyi_agent\\cli.py",
  "fetched_at": null,
  "content_type": "application/json",
  "size": 427,
  "parser_ver": "py-ast-v1",
  "outlinks": null
}