{
  "key": "cb3451cec7f46a29fda48bec142a6e71c39fadfcd5feb7f37f4fec0f883538f8:py-ast-v1",
  "url": "file://C:\\Users\\prest\\Desktop\\Desktop_Projects\\May-Dec-2025\\Tongyi-Agent\\src\\delegation_policy.py",
  "fetched_at": null,
  "content_type": "application/json",
  "size": 1185,
  "parser_ver": "py-ast-v1",
  "outlinks": null
}