{
  "key": "c1c2ecb2ba4c0d8e0b799df7fd2ebc8fde2dd982f7740375013b8ebc1ae699b2:py-ast-v1",
  "url": "file://C:\\Users\\prest\\Desktop\\Desktop_Projects\\May-Dec-2025\\Tongyi-Agent\\src\\sandbox_exec.py",
  "fetched_at": null,
  "content_type": "application/json",
  "size": 1974,
  "parser_ver": "py-ast-v1",
  "outlinks": null
}