{
  "key": "ac08e085a44e8441ce78bc1c8121290ddb7e4072070c24d6e34f8c53b59775d1:py-ast-v1",
  "url": "file://C:\\Users\\prest\\Desktop\\Desktop_Projects\\May-Dec-2025\\Tongyi-Agent\\tests\\test_verifier_gate.py",
  "fetched_at": null,
  "content_type": "application/json",
  "size": 354,
  "parser_ver": "py-ast-v1",
  "outlinks": null
}