{
  "key": "4a51861d5ca8e93dd865a3cdfa2eed6370c54cf1cc5f8afccfeb3da6c0227e99:py-ast-v1",
  "url": "file://C:\\Users\\prest\\Desktop\\Desktop_Projects\\May-Dec-2025\\Tongyi-Agent\\tests\\test_orchestrator_verification.py",
  "fetched_at": null,
  "content_type": "application/json",
  "size": 384,
  "parser_ver": "py-ast-v1",
  "outlinks": null
}