{
  "key": "6458043780b4f19e5ad48559b0fc4ba81044b65c235ae807b3c19333f3fbc41a:py-ast-v1",
  "url": "file://C:\\Users\\prest\\Desktop\\Desktop_Projects\\May-Dec-2025\\Tongyi-Agent\\src\\orchestrator_local.py",
  "fetched_at": null,
  "content_type": "application/json",
  "size": 4081,
  "parser_ver": "py-ast-v1",
  "outlinks": null
}