{
  "key": "6eaf66f692783363e657c99c2620ef61f7c4fe3080d6bcefc041366b0a36d421:py-ast-v1",
  "url": "file://C:\\Users\\prest\\Desktop\\Desktop_Projects\\May-Dec-2025\\Tongyi-Agent\\src\\delegation_clients.py",
  "fetched_at": null,
  "content_type": "application/json",
  "size": 629,
  "parser_ver": "py-ast-v1",
  "outlinks": null
}