{
  "key": "dd599e4e5e68c42670329eb4e3f9417e788a9477a282d1b785ac9d79ef4be7da:py-ast-v1",
  "url": "file://C:\\Users\\prest\\Desktop\\Desktop_Projects\\May-Dec-2025\\Tongyi-Agent\\tests\\test_csv_cleaner_delegation.py",
  "fetched_at": null,
  "content_type": "application/json",
  "size": 686,
  "parser_ver": "py-ast-v1",
  "outlinks": null
}