{
  "key": "de4a1d9f672c56660a60de5a280f28a116b8eaab044e0597a344559ee42f177d:py-ast-v1",
  "url": "file://C:\\Users\\prest\\Desktop\\Desktop_Projects\\May-Dec-2025\\Tongyi-Agent\\src\\csv_utils.py",
  "fetched_at": null,
  "content_type": "application/json",
  "size": 1435,
  "parser_ver": "py-ast-v1",
  "outlinks": null
}