{
  "key": "fb77311a8fc1800529e983e8aa7f03518e4d7288a9bcc313cda0d3932cc8c735:py-ast-v1",
  "url": "file://C:\\Users\\prest\\Desktop\\Desktop_Projects\\May-Dec-2025\\Tongyi-Agent\\tests\\__init__.py",
  "fetched_at": null,
  "content_type": "application/json",
  "size": 24,
  "parser_ver": "py-ast-v1",
  "outlinks": null
}