{
  "key": "255e5ee9bfd560b488981be726f9d19a8af4c9d16663d81f74804f3d83036e13:py-ast-v1",
  "url": "file://C:\\Users\\prest\\Desktop\\Desktop_Projects\\May-Dec-2025\\Tongyi-Agent\\src\\tongyi_orchestrator.py",
  "fetched_at": null,
  "content_type": "application/json",
  "size": 1861,
  "parser_ver": "py-ast-v1",
  "outlinks": null
}