{
  "key": "95bd20d8acb0a22b17aff8318c3063da9c0d19e1eb4070e2fbb8d223b83bc62a:py-ast-v1",
  "url": "file://C:\\Users\\prest\\Desktop\\Desktop_Projects\\May-Dec-2025\\Tongyi-Agent\\tests\\test_integration.py",
  "fetched_at": null,
  "content_type": "application/json",
  "size": 989,
  "parser_ver": "py-ast-v1",
  "outlinks": null
}