{
  "key": "b4c4cb5d88ac0ec047ef6c07a6f77d42bb31e492ec69d931471c5a03d74eec61:py-ast-v1",
  "url": "file://C:\\Users\\prest\\Desktop\\Desktop_Projects\\May-Dec-2025\\Tongyi-Agent\\src\\code_search.py",
  "fetched_at": null,
  "content_type": "application/json",
  "size": 1604,
  "parser_ver": "py-ast-v1",
  "outlinks": null
}