{
  "key": "12f3dd8869be6a6af2dc360f2baac29aa653a400e551344b26d3f30f52a3f24e:py-ast-v1",
  "url": "file://C:\\Users\\prest\\Desktop\\Desktop_Projects\\May-Dec-2025\\Tongyi-Agent\\tests\\test_scholar_adapter.py",
  "fetched_at": null,
  "content_type": "application/json",
  "size": 1350,
  "parser_ver": "py-ast-v1",
  "outlinks": null
}