{
  "key": "17ba0ede80bb0ec05b0393cb0f178fec8092b8c69d89bcabf426df67d12eabc6:py-ast-v1",
  "url": "file://C:\\Users\\prest\\Desktop\\Desktop_Projects\\May-Dec-2025\\Tongyi-Agent\\eval_runner.py",
  "fetched_at": null,
  "content_type": "application/json",
  "size": 713,
  "parser_ver": "py-ast-v1",
  "outlinks": null
}