{
  "key": "b1017f98bc213217d3733c5d9ca87638c6ee206bf7ca5631be825d4ce7aa5de2:py-ast-v1",
  "url": "file://C:\\Users\\prest\\Desktop\\Desktop_Projects\\May-Dec-2025\\Tongyi-Agent\\src\\verifier_gate.py",
  "fetched_at": null,
  "content_type": "application/json",
  "size": 1468,
  "parser_ver": "py-ast-v1",
  "outlinks": null
}