{
  "key": "71f849e3c778de378d91f410128492bc5a19d96c48d125a26bc543ab64c25cc5:py-ast-v1",
  "url": "file://C:\\Users\\prest\\Desktop\\Desktop_Projects\\May-Dec-2025\\Tongyi-Agent\\tools\\base_tool.py",
  "fetched_at": null,
  "content_type": "application/json",
  "size": 1079,
  "parser_ver": "py-ast-v1",
  "outlinks": null
}