{
  "key": "0cd4f4b849848279031226dc9bdccd451ea0124e2f06bc9065e9e61ff6b01ee0:py-ast-v1",
  "url": "file://C:\\Users\\prest\\Desktop\\Desktop_Projects\\May-Dec-2025\\Tongyi-Agent\\config.py",
  "fetched_at": null,
  "content_type": "application/json",
  "size": 478,
  "parser_ver": "py-ast-v1",
  "outlinks": null
}