{
  "key": "75d056b59744f6a76566880aefe6655cc4f80b1e3a5435b586c4c24bddb8d71b:py-ast-v1",
  "url": "file://C:\\Users\\prest\\Desktop\\Desktop_Projects\\May-Dec-2025\\Tongyi-Agent\\src\\cas_store.py",
  "fetched_at": null,
  "content_type": "application/json",
  "size": 1045,
  "parser_ver": "py-ast-v1",
  "outlinks": null
}