{
  "key": "561b05a5c741661018a970ccea54dabd255da6043bc298f6497b63ec1c37b44f:py-ast-v1",
  "url": "file://C:\\Users\\prest\\Desktop\\Desktop_Projects\\May-Dec-2025\\Tongyi-Agent\\tests\\test_sandbox_exec.py",
  "fetched_at": null,
  "content_type": "application/json",
  "size": 1075,
  "parser_ver": "py-ast-v1",
  "outlinks": null
}