{
  "key": "1fb9e5a7c693851ffd8adc155fe14f1f8f5d2fd0ad1109c3da0915363e3366d1:py-ast-v1",
  "url": "file://C:\\Users\\prest\\Desktop\\Desktop_Projects\\May-Dec-2025\\Tongyi-Agent\\tests\\test_symbol_index.py",
  "fetched_at": null,
  "content_type": "application/json",
  "size": 330,
  "parser_ver": "py-ast-v1",
  "outlinks": null
}