{
  "key": "9b4668d70d4b4217de27a9f5d7b6a0128c743ba1d4dd3a25ca40d80672880526:py-ast-v1",
  "url": "file://C:\\Users\\prest\\Desktop\\Desktop_Projects\\May-Dec-2025\\Tongyi-Agent\\src\\drift_monitor.py",
  "fetched_at": null,
  "content_type": "application/json",
  "size": 875,
  "parser_ver": "py-ast-v1",
  "outlinks": null
}