{
  "key": "722f1f625a6cb6806a22ae28035c90dd2d56c5b1f28db70d9a2d60488920798b:py-ast-v1",
  "url": "file://C:\\Users\\prest\\Desktop\\Desktop_Projects\\May-Dec-2025\\Tongyi-Agent\\tests\\test_tongyi_orchestrator.py",
  "fetched_at": null,
  "content_type": "application/json",
  "size": 1770,
  "parser_ver": "py-ast-v1",
  "outlinks": null
}