{
  "key": "bbc0c92eec3bd322817cf6cbd8eb5cdfddaf017ace2e8b6a1e1b0202c5e5f38d:py-ast-v1",
  "url": "file://C:\\Users\\prest\\Desktop\\Desktop_Projects\\May-Dec-2025\\Tongyi-Agent\\tests\\test_orchestrator_sandbox.py",
  "fetched_at": null,
  "content_type": "application/json",
  "size": 623,
  "parser_ver": "py-ast-v1",
  "outlinks": null
}